{
  "meta": {
    "image": "reimu.webp",
    "size": {
      "w": 4096,
      "h": 4096
    },
    "scale": "1"
  },
  "assetType": "character",
  "frames": {
    "idle_front_00": {
      "frame": {
        "x": 0,
        "y": 0,
        "w": 1024,
        "h": 1024
      },
      "rotated": false,
      "trimmed": false,
      "spriteSourceSize": {
        "x": 0,
        "y": 0,
        "w": 1024,
        "h": 1024
      },
      "sourceSize": {
        "w": 1024,
        "h": 1024
      },
      "anchor": {
        "x": 0.5,
        "y": 0.5
      },
      "duration": 160
    },
    "idle_front_01": {
      "frame": {
        "x": 1024,
        "y": 0,
        "w": 1024,
        "h": 1024
      },
      "rotated": false,
      "trimmed": false,
      "spriteSourceSize": {
        "x": 0,
        "y": 0,
        "w": 1024,
        "h": 1024
      },
      "sourceSize": {
        "w": 1024,
        "h": 1024
      },
      "anchor": {
        "x": 0.5,
        "y": 0.5
      },
      "duration": 160
    },
    "idle_front_02": {
      "frame": {
        "x": 2048,
        "y": 0,
        "w": 1024,
        "h": 1024
      },
      "rotated": false,
      "trimmed": false,
      "spriteSourceSize": {
        "x": 0,
        "y": 0,
        "w": 1024,
        "h": 1024
      },
      "sourceSize": {
        "w": 1024,
        "h": 1024
      },
      "anchor": {
        "x": 0.5,
        "y": 0.5
      },
      "duration": 160
    },
    "idle_front_03": {
      "frame": {
        "x": 3072,
        "y": 0,
        "w": 1024,
        "h": 1024
      },
      "rotated": false,
      "trimmed": false,
      "spriteSourceSize": {
        "x": 0,
        "y": 0,
        "w": 1024,
        "h": 1024
      },
      "sourceSize": {
        "w": 1024,
        "h": 1024
      },
      "anchor": {
        "x": 0.5,
        "y": 0.5
      },
      "duration": 160
    },
    "idle_front_04": {
      "frame": {
        "x": 0,
        "y": 1024,
        "w": 1024,
        "h": 1024
      },
      "rotated": false,
      "trimmed": false,
      "spriteSourceSize": {
        "x": 0,
        "y": 0,
        "w": 1024,
        "h": 1024
      },
      "sourceSize": {
        "w": 1024,
        "h": 1024
      },
      "anchor": {
        "x": 0.5,
        "y": 0.5
      },
      "duration": 160
    },
    "idle_front_05": {
      "frame": {
        "x": 1024,
        "y": 1024,
        "w": 1024,
        "h": 1024
      },
      "rotated": false,
      "trimmed": false,
      "spriteSourceSize": {
        "x": 0,
        "y": 0,
        "w": 1024,
        "h": 1024
      },
      "sourceSize": {
        "w": 1024,
        "h": 1024
      },
      "anchor": {
        "x": 0.5,
        "y": 0.5
      },
      "duration": 160
    },
    "idle_front_06": {
      "frame": {
        "x": 2048,
        "y": 1024,
        "w": 1024,
        "h": 1024
      },
      "rotated": false,
      "trimmed": false,
      "spriteSourceSize": {
        "x": 0,
        "y": 0,
        "w": 1024,
        "h": 1024
      },
      "sourceSize": {
        "w": 1024,
        "h": 1024
      },
      "anchor": {
        "x": 0.5,
        "y": 0.5
      },
      "duration": 160
    },
    "idle_front_07": {
      "frame": {
        "x": 3072,
        "y": 1024,
        "w": 1024,
        "h": 1024
      },
      "rotated": false,
      "trimmed": false,
      "spriteSourceSize": {
        "x": 0,
        "y": 0,
        "w": 1024,
        "h": 1024
      },
      "sourceSize": {
        "w": 1024,
        "h": 1024
      },
      "anchor": {
        "x": 0.5,
        "y": 0.5
      },
      "duration": 160
    },
    "walk_front_00": {
      "frame": {
        "x": 0,
        "y": 2048,
        "w": 1024,
        "h": 1024
      },
      "rotated": false,
      "trimmed": false,
      "spriteSourceSize": {
        "x": 0,
        "y": 0,
        "w": 1024,
        "h": 1024
      },
      "sourceSize": {
        "w": 1024,
        "h": 1024
      },
      "anchor": {
        "x": 0.5,
        "y": 0.5
      },
      "duration": 133
    },
    "walk_front_01": {
      "frame": {
        "x": 1024,
        "y": 2048,
        "w": 1024,
        "h": 1024
      },
      "rotated": false,
      "trimmed": false,
      "spriteSourceSize": {
        "x": 0,
        "y": 0,
        "w": 1024,
        "h": 1024
      },
      "sourceSize": {
        "w": 1024,
        "h": 1024
      },
      "anchor": {
        "x": 0.5,
        "y": 0.5
      },
      "duration": 133
    },
    "walk_front_02": {
      "frame": {
        "x": 2048,
        "y": 2048,
        "w": 1024,
        "h": 1024
      },
      "rotated": false,
      "trimmed": false,
      "spriteSourceSize": {
        "x": 0,
        "y": 0,
        "w": 1024,
        "h": 1024
      },
      "sourceSize": {
        "w": 1024,
        "h": 1024
      },
      "anchor": {
        "x": 0.5,
        "y": 0.5
      },
      "duration": 133
    },
    "walk_front_03": {
      "frame": {
        "x": 3072,
        "y": 2048,
        "w": 1024,
        "h": 1024
      },
      "rotated": false,
      "trimmed": false,
      "spriteSourceSize": {
        "x": 0,
        "y": 0,
        "w": 1024,
        "h": 1024
      },
      "sourceSize": {
        "w": 1024,
        "h": 1024
      },
      "anchor": {
        "x": 0.5,
        "y": 0.5
      },
      "duration": 133
    },
    "walk_front_04": {
      "frame": {
        "x": 0,
        "y": 3072,
        "w": 1024,
        "h": 1024
      },
      "rotated": false,
      "trimmed": false,
      "spriteSourceSize": {
        "x": 0,
        "y": 0,
        "w": 1024,
        "h": 1024
      },
      "sourceSize": {
        "w": 1024,
        "h": 1024
      },
      "anchor": {
        "x": 0.5,
        "y": 0.5
      },
      "duration": 133
    },
    "walk_front_05": {
      "frame": {
        "x": 1024,
        "y": 3072,
        "w": 1024,
        "h": 1024
      },
      "rotated": false,
      "trimmed": false,
      "spriteSourceSize": {
        "x": 0,
        "y": 0,
        "w": 1024,
        "h": 1024
      },
      "sourceSize": {
        "w": 1024,
        "h": 1024
      },
      "anchor": {
        "x": 0.5,
        "y": 0.5
      },
      "duration": 133
    }
  },
  "animations": {
    "idle_front": [
      "idle_front_00",
      "idle_front_01",
      "idle_front_02",
      "idle_front_03",
      "idle_front_04",
      "idle_front_05",
      "idle_front_06",
      "idle_front_07"
    ],
    "walk_front": [
      "walk_front_00",
      "walk_front_01",
      "walk_front_02",
      "walk_front_03",
      "walk_front_04",
      "walk_front_05"
    ]
  },
  "inputs": {
    "speed": {
      "type": "number",
      "default": 0
    }
  },
  "states": {
    "idle": {
      "animation": "idle_front",
      "loop": true
    },
    "walk": {
      "animation": "walk_front",
      "loop": true
    }
  },
  "transitions": [
    {
      "from": "*",
      "to": "walk",
      "priority": 0,
      "when": [
        { "input": "speed", "op": "GreaterThan", "value": 0 }
      ]
    },
    {
      "from": "*",
      "to": "idle",
      "priority": 0,
      "when": [
        { "input": "speed", "op": "Equals", "value": 0 }
      ]
    }
  ],
  "initial": "idle"
}