{
  "meta": {
    "image": "fireball.webp",
    "format": "RGBA8888",
    "size": {
      "w": 2140,
      "h": 1705
    },
    "scale": "1",
    "frameTags": [
      {
        "name": "idle_loop",
        "from": 0,
        "to": 5,
        "direction": "forward"
      }
    ]
  },
  "assetType": "effect",
  "frames": {
    "idle_loop_00": {
      "frame": {
        "x": 0,
        "y": 0,
        "w": 733,
        "h": 873
      },
      "rotated": false,
      "trimmed": true,
      "spriteSourceSize": {
        "x": 133,
        "y": 78,
        "w": 733,
        "h": 873
      },
      "sourceSize": {
        "w": 1024,
        "h": 1024
      },
      "anchor": {
        "x": 0.486,
        "y": 0.477
      },
      "duration": 125
    },
    "idle_loop_01": {
      "frame": {
        "x": 620,
        "y": 875,
        "w": 675,
        "h": 798
      },
      "rotated": false,
      "trimmed": true,
      "spriteSourceSize": {
        "x": 103,
        "y": 77,
        "w": 675,
        "h": 798
      },
      "sourceSize": {
        "w": 1024,
        "h": 1024
      },
      "anchor": {
        "x": 0.486,
        "y": 0.477
      },
      "duration": 125
    },
    "idle_loop_02": {
      "frame": {
        "x": 1524,
        "y": 0,
        "w": 616,
        "h": 863
      },
      "rotated": false,
      "trimmed": true,
      "spriteSourceSize": {
        "x": 206,
        "y": 24,
        "w": 616,
        "h": 863
      },
      "sourceSize": {
        "w": 1024,
        "h": 1024
      },
      "anchor": {
        "x": 0.486,
        "y": 0.477
      },
      "duration": 125
    },
    "idle_loop_03": {
      "frame": {
        "x": 735,
        "y": 0,
        "w": 787,
        "h": 871
      },
      "rotated": false,
      "trimmed": true,
      "spriteSourceSize": {
        "x": 121,
        "y": 77,
        "w": 787,
        "h": 871
      },
      "sourceSize": {
        "w": 1024,
        "h": 1024
      },
      "anchor": {
        "x": 0.486,
        "y": 0.477
      },
      "duration": 125
    },
    "idle_loop_04": {
      "frame": {
        "x": 0,
        "y": 875,
        "w": 618,
        "h": 830
      },
      "rotated": false,
      "trimmed": true,
      "spriteSourceSize": {
        "x": 203,
        "y": 76,
        "w": 618,
        "h": 830
      },
      "sourceSize": {
        "w": 1024,
        "h": 1024
      },
      "anchor": {
        "x": 0.486,
        "y": 0.477
      },
      "duration": 125
    },
    "idle_loop_05": {
      "frame": {
        "x": 1297,
        "y": 875,
        "w": 522,
        "h": 795
      },
      "rotated": false,
      "trimmed": true,
      "spriteSourceSize": {
        "x": 249,
        "y": 79,
        "w": 522,
        "h": 795
      },
      "sourceSize": {
        "w": 1024,
        "h": 1024
      },
      "anchor": {
        "x": 0.486,
        "y": 0.477
      },
      "duration": 125
    }
  },
  "animations": {
    "idle_loop": [
      "idle_loop_00",
      "idle_loop_01",
      "idle_loop_02",
      "idle_loop_03",
      "idle_loop_04",
      "idle_loop_05"
    ]
  }
}
