{
  "meta": {
    "image": "chest.webp",
    "size": {
      "w": 4096,
      "h": 3072
    },
    "scale": "1"
  },
  "assetType": "object",
  "frames": {
    "open_front_00": {
      "frame": {
        "x": 0,
        "y": 0,
        "w": 1024,
        "h": 1024
      },
      "rotated": false,
      "trimmed": false,
      "spriteSourceSize": {
        "x": 0,
        "y": 0,
        "w": 1024,
        "h": 1024
      },
      "sourceSize": {
        "w": 1024,
        "h": 1024
      },
      "anchor": {
        "x": 0.5,
        "y": 0.5
      },
      "duration": 100
    },
    "open_front_01": {
      "frame": {
        "x": 1024,
        "y": 0,
        "w": 1024,
        "h": 1024
      },
      "rotated": false,
      "trimmed": false,
      "spriteSourceSize": {
        "x": 0,
        "y": 0,
        "w": 1024,
        "h": 1024
      },
      "sourceSize": {
        "w": 1024,
        "h": 1024
      },
      "anchor": {
        "x": 0.5,
        "y": 0.5
      },
      "duration": 100
    },
    "open_front_02": {
      "frame": {
        "x": 2048,
        "y": 0,
        "w": 1024,
        "h": 1024
      },
      "rotated": false,
      "trimmed": false,
      "spriteSourceSize": {
        "x": 0,
        "y": 0,
        "w": 1024,
        "h": 1024
      },
      "sourceSize": {
        "w": 1024,
        "h": 1024
      },
      "anchor": {
        "x": 0.5,
        "y": 0.5
      },
      "duration": 100
    },
    "open_front_03": {
      "frame": {
        "x": 3072,
        "y": 0,
        "w": 1024,
        "h": 1024
      },
      "rotated": false,
      "trimmed": false,
      "spriteSourceSize": {
        "x": 0,
        "y": 0,
        "w": 1024,
        "h": 1024
      },
      "sourceSize": {
        "w": 1024,
        "h": 1024
      },
      "anchor": {
        "x": 0.5,
        "y": 0.5
      },
      "duration": 100
    },
    "open_front_04": {
      "frame": {
        "x": 0,
        "y": 1024,
        "w": 1024,
        "h": 1024
      },
      "rotated": false,
      "trimmed": false,
      "spriteSourceSize": {
        "x": 0,
        "y": 0,
        "w": 1024,
        "h": 1024
      },
      "sourceSize": {
        "w": 1024,
        "h": 1024
      },
      "anchor": {
        "x": 0.5,
        "y": 0.5
      },
      "duration": 100
    },
    "open_front_05": {
      "frame": {
        "x": 1024,
        "y": 1024,
        "w": 1024,
        "h": 1024
      },
      "rotated": false,
      "trimmed": false,
      "spriteSourceSize": {
        "x": 0,
        "y": 0,
        "w": 1024,
        "h": 1024
      },
      "sourceSize": {
        "w": 1024,
        "h": 1024
      },
      "anchor": {
        "x": 0.5,
        "y": 0.5
      },
      "duration": 100
    },
    "shine_front_00": {
      "frame": {
        "x": 2048,
        "y": 1024,
        "w": 1024,
        "h": 1024
      },
      "rotated": false,
      "trimmed": false,
      "spriteSourceSize": {
        "x": 0,
        "y": 0,
        "w": 1024,
        "h": 1024
      },
      "sourceSize": {
        "w": 1024,
        "h": 1024
      },
      "anchor": {
        "x": 0.5,
        "y": 0.5
      },
      "duration": 100
    },
    "shine_front_01": {
      "frame": {
        "x": 3072,
        "y": 1024,
        "w": 1024,
        "h": 1024
      },
      "rotated": false,
      "trimmed": false,
      "spriteSourceSize": {
        "x": 0,
        "y": 0,
        "w": 1024,
        "h": 1024
      },
      "sourceSize": {
        "w": 1024,
        "h": 1024
      },
      "anchor": {
        "x": 0.5,
        "y": 0.5
      },
      "duration": 100
    },
    "shine_front_02": {
      "frame": {
        "x": 0,
        "y": 2048,
        "w": 1024,
        "h": 1024
      },
      "rotated": false,
      "trimmed": false,
      "spriteSourceSize": {
        "x": 0,
        "y": 0,
        "w": 1024,
        "h": 1024
      },
      "sourceSize": {
        "w": 1024,
        "h": 1024
      },
      "anchor": {
        "x": 0.5,
        "y": 0.5
      },
      "duration": 100
    },
    "shine_front_03": {
      "frame": {
        "x": 1024,
        "y": 2048,
        "w": 1024,
        "h": 1024
      },
      "rotated": false,
      "trimmed": false,
      "spriteSourceSize": {
        "x": 0,
        "y": 0,
        "w": 1024,
        "h": 1024
      },
      "sourceSize": {
        "w": 1024,
        "h": 1024
      },
      "anchor": {
        "x": 0.5,
        "y": 0.5
      },
      "duration": 100
    }
  },
  "animations": {
    "open_front": [
      "open_front_00",
      "open_front_01",
      "open_front_02",
      "open_front_03",
      "open_front_04",
      "open_front_05"
    ],
    "shine_front": [
      "shine_front_00",
      "shine_front_01",
      "shine_front_02",
      "shine_front_03"
    ]
  }
}